"idattribute","componentid","name","definition","units","value"
"228","72","Processes:WetDeposition","Wet deposition is included or not. Wet deposition describes the moist processes by which species deposit themselves on solid surfaces thus decreasing their concentration in the air.",,"yes"
"229","72","Processes:WashOut-RainOut","Downward transport of soluble chemistry species in clouds.",,"N/A"
"230","72","Processes:Coagulation","Coagulation is included in the stratospheric heterogeneous chemistry scheme or not. Coagulation is a process by which aerosol particles grow. ",,"no"
"231","72","NumOfReactionsAndSpecies:NumberOfReactions","The number of reactions in the tropospheric heterogeneous chemistry scheme.",,"N/A"
"232","72","NumOfReactionsAndSpecies:NumberOfAdvectedSpecies","Number of advected species in the tropospheric heterogeneous chemistry scheme.",,"N/A"
"233","72","NumOfReactionsAndSpecies:NumberOfSteadyStateSpecies","Number of steady state species in the tropospheric heterogeneous chemistry scheme.",,"N/A"
"234","73","Photolysis:Method","Photolysis scheme online or offline. offline (clearsky): Look up tables do not take clouds into account. offline (with clouds): Look up tables take clouds into account with respect to effective photolysis rate for photodissociation.",,"offline (with clouds)"
"235","73","Photolysis:ReactionData","Reaction information taken into account by the photolysis scheme.",,"updated reaction absorption cross sections, updated reaction quantum yields"
"237","73","NumOfReactionsAndSpecies:NumberOfReactions","The number of reactions in the photo-chemistry scheme.",,"25"
"238","73","NumOfReactionsAndSpecies:NumberOfSpecies","The number of species in the photo-chemistry scheme.",,"18"
"239","179","PassiveTracers:Method","Time stepping method for passive tracers.",,"use Ocean transport time step"
"241","179","Biology:Method","Time stepping method for ocean biology.",,"use ocean transport time step"
"243","91","General Attributes:BasicApproximations","Description of the basic approximations made in the biogeo chemistry model.",,"Eulerian model, N3 P2 Z1 D1 ecosystem; no diel cycle, constant detrital sinking rate, constant (carbonate) rain ratio"
"244","91","General Attributes:ListOfPrognosticVariables","Prognostic variables of the ocean biogeo chemistry model.",,"Dissolved inorganic nitrogen (nitrate+ammonia); dissolved silicate; dissolved iron; diatoms; other phytoplankton; zooplankton; diatom silicate; detrital nitrogen; detrital carbon; detrital silicate; dissolved inorganic carbon; total alkalinity; dissolved oxygen."
"245","91","BioGeoTracersDamping:ListOfTracers","List of tracers to which a damping is applied.",,"None"
"246","91","BioGeoTracersDamping:LatMin","Southern boundary of the tracers damping zone.","degN","n/a"
"247","91","BioGeoTracersDamping:LatMax","Northern boundary of the tracers damping zone.","degN","n/a"
"248","91","BioGeoTracersDamping:LonMin","Western boundary of the tracers damping zone.","degE","n/a"
"249","91","BioGeoTracersDamping:LonMax","Eastern boundary of the tracers damping zone.","degE","n/a"
"250","91","BioGeoTracersDamping:UpperLevel","Upper level of the tracers damping zone.","meters","n/a"
"251","91","BioGeoTracersDamping:LowerLevel","Lower level of the tracers damping zone.","meters","n/a"
"252","91","Transport:Method","Method for transport for ocean biogeochemistry.",,"online, different from Ocean Tracers"
"253","91","Transport:MethodCharacteristics","Description of the specificities of the ocean biogeochemistry transport method (compared to Ocean tracers one).",,"UTOPIA with flux-limiter"
"254","92","General Attributes:AtmosphericDeposition","How deposition of biogeochemical matter from atmosphere is provided to ocean biogeochemistry model.",,"other"
"255","92","General Attributes:RiverInput","How biogeochemical substances and particules present in rivers are provided to ocean biogeochemistry model.",,"N/A"
"256","92","General Attributes:SedimentInteractions","How the sediments materials are provided to ocean biogeochemistry model.",,"N/A"
"257","93","CO2:Present","Is exchange of carbon dioxide taken into account in the air-sea interaction processes?",,"yes"
"258","93","CO2:SchemeType","Scheme used for formulation of CO2 transfer velocity.",,"Wanninkhof"
"259","93","O2:Present","Is exchange of oxygen taken into account in the air-sea interaction processes?",,"yes"
"260","93","O2:SchemeType","Scheme used for formulation of O2 transfer velocity.",,"Wanninkhof"
"261","93","DMS:Present","Is exchange of dimethyl sulfid taken into account in the air-sea interaction processes?",,"yes"
"262","93","DMS:SchemeType","Scheme used for formulation of DMS transfer velocity.",,"Wanninkhof"
"263","93","N2:Present","Is exchange of nitrogen taken into account in the air-sea interaction processes?",,"no"
"265","93","N2O:Present","Is exchange of nitrogen oxide taken into account in the air-sea interaction processes?",,"no"
"267","93","CO:Present","Is exchange of carbon oxide taken into account in the air-sea interaction processes?",,"no"
"269","94","General Attributes:SulfurCycle","Is sulfur cycle included in ocean biogeochemistry model?",,"no"
"270","94","Nutrients:ListOfSpecies","List of species (gazeous, organic or mineral) that act as as nutriments.",,"Iron (Fe), Nitrogen (N), Silicium (Si)"
"271","94","Nutrients:NitrousSpecies","List of nutriments derived from nitrogen.",,"Amonium (NH4), Nitrates (NO3)"
"272","94","Nutrients:Processes","List of chemical processes involving nitrogen.",,"other"
"273","94","DisolvedOrganicMatter:Lability","Is the lability of dissolved organic matter taken into account in the ocean biogeochemistry model?",,"no"
"274","94","DisolvedOrganicMatter:BacteriaRepresentation","Are bacteria taken into account in the ocean biogeochemistry model?",,"no"
"275","94","Particules:Method","How the particulate carbon are represented in oceanbiogeochemistry model.",,"prognostic"
"276","94","Particules:TypesOfParticules","Type of particulate matter taken into account in the ocean biogeochemistry model. POC: Particulate Organic Carbon. PIC (calcite): Particulate Inorganic Carbon (calcite). PIC (aragonite): Particulate Inorganic Carbon (aragonite). BSi: Biogenic Silica.",,"BSi, PIC (calcite), POC"
"277","94","Particules:SizeSpectrum","Is a particule size spectrum used to represent distribution of particules in the water volume?",,"no"
"278","94","Particules:SinkingSpeed","Method for calculation of particule sinking speed.",,"other"
"279","95","General Attributes:UpperTrophicLevels","Definition of property name UpperTrophicLevels required",,"no"
"280","95","Phytoplancton:Type","Approach used to represent the phytoplancton in the ocean biogeochemistry model.",,"generic"
"282","95","Zooplancton:Type","Approach used to represent the zooplancton in the biogeochemistry model.",,"generic"
"284","96","CarbonChemistry:pH-scale","Definition of property name pH-scale required",,"sea water"
"285","96","CarbonChemistry:CarbonChemConstants","Definition of property name CarbonChemConstants required",,"DOE(1994) (for K1, K2, Kw, and Kb)"
"286","80","General Attributes:BasicApproximations","Decription of the basic approximations made in the LandSurface model.",,"Linearisation of the surface energy balance equations"
"287","80","General Attributes:Genealogy","History of parent models.",,"other"
"288","80","General Attributes:CouplingWithAtmosphere","Specify the treatment of land surface coupling with the Atmosphere model component.",,"implicit"
"289","80","General Attributes:LandCoverTypes","Types of land cover defined in the land surface model.",,"bare soil, ice, urban, vegetated"
"290","80","General Attributes:ListOfPrognosticVariables","Specify which prognostic variables are included in the land surface scheme.",,"canopy heat content, canopy skin temperature, canopy snow content, canopy water content, snow albedo, snow mass, soil heat content, soil ice content, soil moisture, soil temperature, surface skin temperature"
"291","80","General Attributes:Tiling","Is land surface tiling common to all land surface subcomponents?",,"common to all LS subcomponents"
"292","80","General Attributes:TilingMethod","Describe the method of tiling used",,"dynamic"
"293","80","ConservationOfProperties:WaterTreatment","Specify the treatment of water to ocean",,"All water sent to ocean (with a lag)"
"294","80","ConservationOfProperties:LagOfWaterDischarge","Value of the lag duration of the water discharge into ocean.",,"simulated by river flow model"
"296","80","TimeSteppingFramework:Method","Is the time stepping framework used the same as that used in the atmosphere model component?",,"use Atmosphere time step"
"298","81","SoilMap:Texture","Description of the relative clay, sand and silt proportions of the soil",,"Soil properties are derived from fractions of clay, sand and silt defined in the datasets available from the IGBP DIS"
"299","81","SoilMap:Structure","Description of the aggregate characteristics of the soil particles",,"The soil has four layers of increasing thickness up to a depth of 3m each with the same soil properties. In addition there is a deeper layer (extending down to 6m below the surface) which has a saturated hydraulic conductivity which decreases exponentially with depth (Gedney and Cox, 2003)"
"300","81","SoilMap:Albedo","Ratio of reflected to incoming solar radiation on a land surface",,"Derived from MODIS data as defined in Houldcroft et al. (2008)"
"301","81","SoilMap:WaterTable","Description of the level of water saturation within the soil layer",,"As described in Gedney and Cox (2003)"
"302","82","SoilHydrologyAttributes:SpecificTiling","Does the model use a tiling scheme within soil hydrology?",,"no"
"303","82","SoilHydrologyAttributes:NumberOfGroundWaterLayers","Enter the number of ground water levels used in the land surface scheme/model",,"4"
"304","82","SoilHydrologyAttributes:WaterStorageMethod","Describe the method by which water is stored in the land surface scheme/model",,"Explicit diffusion"
"305","82","SoilMoistureFreezing:NumberOfGroundIceLayers","How many ground ice layers are included in the land surface scheme",,"4"
"306","82","SoilMoistureFreezing:IceStorageMethod","Describe the method of ice storage",,"Prognostic frozen fraction of saturation"
"307","82","SoilMoistureFreezing:Permafrost","Describe the treatment of permafrost within the land surface scheme",,"other"
"308","82","Runoff-Drainage:Method","Specify the treatment of runoff",,"differentiated drainage and runoff"
"309","82","Runoff-Drainage:Processes","Specify processes treated within the runoff and drainage scheme",,"deep drainage, infiltration excess runoff"
"310","180","SoilHeatTreatmentAttributes:SpecificTiling","Is tiling used in the treatment of soil heat? ",,"no"
"311","180","SoilHeatTreatmentAttributes:NumberOfGroundHeatLayers","How many layers are used in ground heat treatment?",,"4"
"312","180","Method:HeatStorage","Specify the method of heat storage",,"Explicit diffusion"
"313","180","Method:Processes","Describe processes included in the treatment of soil heat",,"soil moisture freeze-thaw"
"314","83","General Attributes:SpecificTiling","Is tiling used in the land surface snow scheme?",,"yes"
"315","83","General Attributes:NumberOfSnowLayers","How many snow layers are included in the model?",,"1"
"316","83","SchemeMethod:SnowAlbedo","List of biome types of the classification used.",,"diagnostic"
"317","83","SchemeMethod:SnowDensity","Description of the treatment of snow density",,"constant"
"318","83","SchemeMethod:SnowWaterEquivalent","Description of the treatment of the snow water equivalent",,"prognostic"
"319","83","SchemeMethod:SnowHeatContent","Description of the treatment of the heat content of snow",,"other"
"320","83","SchemeMethod:SnowTemperature","Description of the treatment of snow temperature",,"prognostic"
"321","83","SchemeMethod:SnowLiquidWaterContent","Description of the treatment of the snow liquid water treatment",,"N/A"
"322","83","SchemeMethod:SnowCoverFractions","Specify cover fractions used in the surface snow scheme",,"ground snow fraction, vegetation snow fraction"
"323","83","SchemeMethod:Processes","Implemented snow-related processes",,"snow interception, snow melting"
"324","84","General Attributes:SpecificTiling","Is tiling used in the surface vegetation scheme?",,"yes"
"325","84","General Attributes:VegetationRepresentation","Vegetation classification used.",,"vegetation types"
"326","84","General Attributes:VegetationTimeVariation","How the vegetation fractions in each tile are varying with time.",,"dynamical (varying from simulation)"
"327","84","General Attributes:Interception","Vegetation interception of rainwater represented?",,"yes"
"329","84","General Attributes:VegetationTypes","List of vegetation types in the classification.",,"broadleaf tree, C3 grass, C4 grass, needleleaf tree, other"
"331","84","SchemeMethod:Phenology","Description of the treatment of vegetation phenology",,"prognostic"
"332","84","SchemeMethod:LAI","Describe the treatment of the leaf area index",,"prognostic"
"333","84","SchemeMethod:Biomass","Describe the treatment of vegetation biomass",,"diagnostic"
"334","84","SchemeMethod:BioGeography","describe the treatment of vegetation biogeography",,"prognostic"
"335","84","SchemeMethod:StomatalResistanceFunctionOf","Specify the dependancies on vegetation stomatal resistance",,"CO2, light, temperature, water availability"
"336","85","General Attributes:SpecificTiling","Is tiling used in the surface energy balance scheme?",,"yes"
"337","85","General Attributes:NumberOfSurfaceTemperatures","Enter the number of surface temperatures used",,"9"
"338","85","General Attributes:SubsurfaceTiling","Is sub-surface tiling employed?",,"no"
"339","85","SchemeMethod:TypeOfEvaporationFormulation","Specify the formulation method for land surface evaporation",,"combined"
"340","85","SchemeMethod:Processes","Describe whih processes are included in the energy balance scheme",,"transpiration"
"341","86","General Attributes:SpecificTiling","Is tiling used in the surface albedo calcualtions?",,"yes"
"342","86","SnowFreeAlbedo:Type","Describe the treatment of snow-free land albedo",,"prognostic"
"343","86","SnowFreeAlbedo:FunctionOf","Describe the dependancies on snow free albedo calculations",,"vegetation state, vegetation type"
"344","86","SnowFreeAlbedo:Direct-Diffuse","Is there a distinction between direct and diffuse albedo?",,"no distinction between direct and diffuse albedo"
"345","86","SnowFreeAlbedo:NumberOfWavelenghBands","Enter the number of wavelength bands used",,"1"
"346","86","SnowAlbedo:Type","Describe the treatment of snow-covered land albedo",,"prognostic"
"347","86","SnowAlbedo:FunctionOf","Describe dependancies on snow albedo calculations",,"vegetation type"
"348","87","Soil:Method","Describe the methods used within the soil carbon cycle scheme",,"heterotrophic respiration"
"349","87","Soil:NumberOfCarbonPools","How many soil carbon cycle pools are used?",,"4"
"350","87","Soil:ListOfCarbonPools","List the names of the soil carbon pools used",,"DPM, RPM, BIO, HUM"
"351","87","Permafrost:ListOfGases","Which gases are included in permafrost?",,"N/A"
"352","88","General Attributes:NumberOfCarbonPools","Enter the number of carbon pools used",,"3"
"353","88","General Attributes:ListOfCarbonPools","List the carbon pools used within the model carbon cycle",,"leaf, wood, root carbon.  [These are diagnosed from the canopy height and LAI of the vegetation]"
"354","88","Photosynthesis:Method","Describe the method used for photosynthesis",,"carbon assimilation approach"
"355","88","AutotrophicRespiration:Method","Describe the treatment of autotrophic respiration",,"parametrized"
"356","88","AutotrophicRespiration:MaintenanceRespiration","Definition of property name MaintenanceRespiration required",,"whole plant (no distinction)"
"357","88","Allocation:AllocationBins","Specify the allocation of vegetation carbon bins",,"leaves + stems + roots"
"358","88","Allocation:AllocationFractions","Describe how the fractions of allocation are calculated",,"function of vegetation type"
"359","88","Phenology:Method","Describe the treatment of vegetation carbon cycle phenology",,"parametrized"
"360","89","General Attributes:SpecificTiling","Tiling of basins.",,"yes"
"361","89","General Attributes:Resolution","Is the resolution independant of the land surface resolution?",,"independent"
"362","89","General Attributes:NumberOfReservoirs","Enter the number of reservoirs",,"1"
"363","89","General Attributes:ListOfPrognosticVariables","Specify the prognostic variables within the river routing scheme",,"water"
"364","89","General Attributes:WaterRe-evaporation","Definition of property name WaterRe-evaporation required",,"N/A"
"365","89","General Attributes:CouplingWithAtmosphere","Is river routing coupled to the atmosphere model component?",,"yes"
"366","89","General Attributes:DrainageMap","What type of drainage map is being used?",,"present-day"
"367","89","General Attributes:QuantitiesExchangedWithAtmosphere","Which quantities are exchanged between river routing and the atmosphere model components?",,"water"
"368","89","OceanicDischarge:Type","Specify how rivers are discharged to the ocean",,"direct (large rivers)"
"369","89","OceanicDischarge:QuantitiesTransported","Which quantities are exchanged from river-routing to the ocean model component?",,"water"
"370","90","General Attributes:CouplingWithRivers","Are lakes coupled to the river routing model component?",,"no"
"371","90","General Attributes:QuantitiesExchangedWithRivers","Which quantities are exchanged between the lakes and rivers",,"other"
"372","90","SchemeMethod:IceTreatment","Is lake ice included?",,"no"
"373","90","SchemeMethod:LakesAlbedo","Describe the treatment of lake albedo",,"other"
"374","90","SchemeMethod:LakesDynamics","Which dynamics of lakes are treated? horizontal, vertical, etc. ",,"none"
"375","90","SchemeMethod:DynamicLakesExtent","|Is a dynamic lake extent scheme included?",,"no"
"376","90","SchemeMethod:EndorheicBasins"," basins not flowing to ocean.",,"no"
"377","64","TimeSteppingFramework:TimeSteppingMethod",,,"The atmospheric chemistry model uses the same timestep as the atmosphere model, but has an internal timestep of 5 mins for calculating the reactions"
"378","57","General Attributes:ModelFamily","Type of atmospheric model.",,"AGCM"
"379","57","General Attributes:BasicApproximations","Basic approximations made in the atmospheric model.",,"non-hydrostatic"
"380","57","General Attributes:VolcanoesImplementation","How the volcanoes effect is modeled in the atmophere.",,"via stratospheric aerosols optical thickness"
"381","57","General Attributes:VolcanoesImplementationMethod","Details of volcanoes implementation method.",,"monthly stratospheric optical    depths, at 550nm, prescribed for quarter-spheres (90S-30S, 30S-0, 0-30N, 30N-90N)"
"382","57","Orography:OrographyType","Time adaptation of the orography.",,"present-day"
"384","58","General Attributes:ListOfPrognosticVariables","List of the prognostic variables of the model.",,"clouds, potential temperature, vapour/solid/liquid, wind components"
"385","58","General Attributes:TopBoundaryCondition","Type of boundary layer at top of the model. sponge layer: A sponge layer is present at the top of the atmospheric model to prevent from gravity waves refection at the upper boundary.",,"radiation boundary condition"
"386","58","General Attributes:HeatTreatmentAtTop","Description of any specific treatment of heat at top of the model.",,"N/A"
"387","58","General Attributes:WindTreatmentAtTop","Description of any specific treatment of wind at top of the model.",,"N/A"
"388","58","General Attributes:LateralBoundaryCondition","Type of lateral boundary condition (only if the model is a RCM).",,"N/A"
"389","58","TimeSteppingFramework:SchemeType","Type of time stepping scheme.",,"semi-Implicit"
"390","58","TimeSteppingFramework:TimeStep","Time step of the model.","seconds","30 minutes"
"391","58","HorizontalDiscretization:SchemeType","Type of horizontal discretization scheme.",,"fixed grid"
"392","58","HorizontalDiscretization:PoleSingularityTreatment","Method used to deal with the pole singularities.",,"other"
"393","58","HorizontalDiscretization:SchemeMethod","Numerical method for the horizontal discretization scheme.",,"centered finite differences"
"394","58","HorizontalDiscretization:SchemeOrder","Order of the (centered) finite differences method used by the horizontal dicretization scheme.",,"second order"
"395","58","HorizontalDiffusion:SchemeName","Commonly used name of the horizontal diffusion scheme.",,"horizontal diffusion scheme"
"396","58","HorizontalDiffusion:SchemeMethod","Numerical method used by horizontal diffusion scheme.",,"iterated Laplacian"
"397","59","Tracers:SchemeName","Commonly used name for tracers advection scheme. Heun: Modified Euler (predictor-corrector) method with 4th order spatial differencing in the horizontal and 2nd order spatial differencing in the vertical. Roe and VanLeer: Flux corrected transport scheme comprised of the first order Roe Scheme and the Van Leer flux limiting scheme. Roe and Superbee: Flux corrected transport scheme comprised of the first order Roe Scheme and the Superbee flux limiting scheme. Prather: 1-dimensional, conservative scheme extended to multi-dimensions by operator splitting and conserves the 1st and 2nd-order moments. UTOPIA: Fully multidimensional, quasi-3rd-order, finite volume scheme.",,"other"
"398","59","Tracers:SchemeCharacteristics","Characteristics of the numerical scheme used for advection of tracers. cubic semi-Lagrangian: Semi-Lagrangian scheme with cubic interpolation. quintic semi-Lagrangian: Semi-Lagrangian scheme with quintic interpolation. linear: 1-dimensional, conservative scheme extended to multi-dimensions by operator splitting. quadratic: 1-dimensional, conservative scheme extended to multi-dimensions by operator splitting. quartic: 1-dimensional, conservative scheme extended to multi-dimensions by operator splitting.",,"cubic semi-Lagrangian,quintic semi-Lagrangian "
"399","59","Tracers:ConservedQuantities","Quantities conserved trought tracers advection scheme.",,"Tracer mass (all tracers)"
"400","59","Tracers:ConservationMethod","Method used to ensure conservation in tracers advection scheme.",,"conservation fixer"
"401","59","Momentum:SchemeName","Commonly used name for momentum advection scheme.",,"other"
"402","59","Momentum:SchemeCharacteristics","Characteristics of the numerical scheme used for advection of momentum.",,"staggered grid"
"403","59","Momentum:ConservedQuantities","Quantities conserved through momentum advection scheme.",,"Total energy"
"405","59","Momentum:StaggeringType","Type of staggered grid.",,"Arakawa C-grid"
"406","60","General Attributes:TimeStep","Time step of the radiative scheme.","seconds","3 hours"
"407","60","General Attributes:AerosolTypes","Types of aerosols whose radiative effect is taken into account in the atmospheric model.",,"BC (black carbon / soot), dust, nitrate, POM (particulate organic matter), sea salt, SOA (secondary organic aerosols), sulphate"
"408","60","General Attributes:GHG-Types","GHG whose radiative effect is taken into account in the atmospheric model.",,"CFC, CH4, CO2, H2O, N2O, O3"
"409","60","Longwave:SchemeType","Type of scheme used for longwave radiation parametrization.",,"K-correlated"
"410","60","Longwave:SchemeMethod","Method for the radiative transfert calculations used in the longwave scheme. two-stream: Discrete-ordinate scattering algorithm used to model the scattering of thermal infrared by clouds.",,"two-stream"
"411","60","Longwave:NumberOfSpectralIntervals","Number of spectral intervals of the longwave radiation scheme.",,"9"
"412","60","Shortwave:SchemeType","Type of scheme used for shortwave radiation parametrization.",,"other"
"413","60","Shortwave:NumberOfSpectralIntervals","Number of spectral intervals of the shortwave radiation scheme.",,"6"
"414","60","CloudRadiativeProperties:ice","Radiative properties of ice cristals in clouds.",,"Parameterised as function of ice mass mixing ratio and effective dimension."
"415","60","CloudRadiativeProperties:liquid","Radiative properties of cloud droplets.",,"Parameterised as function of liquid mass mixing ratio and effective radius."
"416","61","BoundaryLayerTurbulence:SchemeName","Commonly used name for boundary layer tubulence scheme.",,"other"
"417","61","BoundaryLayerTurbulence:SchemeType","Type of scheme used for parametrization of turbulence in the boundary layer.",,"vertical profile of Kz"
"418","61","BoundaryLayerTurbulence:CounterGradient","Application of a counter-gradient term for calculation of the vertical turbulent heat fluxes in case of slighlty stable layer; 
counter-gradient heat flux for parametrization of the nonlocal vertical diffusion.",,"yes"
"420","61","BoundaryLayerTurbulence:BLTurbulenceSchemeName",,,"after Lock et al. (2000)"
"421","61","DeepConvection:SchemeName","Commonly used name for deep convection scheme.",,"Gregory and Rowntree"
"422","61","DeepConvection:SchemeType","Type of scheme used for parametrization of deep convection.",,"mass-flux"
"423","61","DeepConvection:Processes","Physical processes taken into account in the parametrization of the deep convection. penetrative convection: Effects of penetrative convection taken into account. updrafts and downdrafts: Representation of updrafts and downdrafts.",,"convective momentum transport (CMT), detrainment, entrainment, radiative effects of anvils, updrafts and downdrafts"
"424","61","DeepConvection:SchemeMethod","Method for mass flux calculation in deep convection. CAPE: Mass flux determined by CAPE. bulk: A bulk mass flux scheme is used.",,"CAPE"
"425","61","ShallowConvection:Method","Method used for parametrization of shallow convection.",,"same as deep (unified)"
