"idattribute","componentid","name","definition","units","value"
"426","61","ShallowConvection:SchemeName","Commonly used name for shallow convection scheme.",,"Grant and Brown"
"427","61","ShallowConvection:SchemeType","Type of scheme used for parametrization of shallow convection.",,"mass-flux"
"428","61","OtherConvection:SchemeName","Commonly used scheme name for other type convection.",,"Mid-Level Convection"
"429","61","OtherConvection:SchemeType","Type of scheme used for parametrization of other type of convection.",,"mass-flux"
"430","61","LargeScalePrecipitation:SchemeName","Commonly used name of the large scale precipitation parametrization scheme.",,"Wilson and Ballard (1999; updated)"
"431","61","LargeScalePrecipitation:PrecipitatingHydrometeors","Precipitating hydrometeors taken into account in the large scale precipitation scheme.",,"graupel, hail, liquid rain, snow"
"432","61","Microphysics:SchemeName","Commonly used name of the microphysics parametrization scheme.",,"Smith (1990) for cloud amount and cloud water content;  Wilson and Ballard (1999, updated) for cloud microphysics"
"433","61","Microphysics:Processes","Microphysical processes taken into account in the microphysics scheme.",,"cloud droplets, cloud ice, effect of graupel, effect of raindrops, effect of snow, ice nucleation, mixed phase, water vapour deposition"
"434","62","CloudSchemeAttributes:SeparatedCloudTreatment","Different cloud schemes for the different types of clouds (convective, stratiform and bondary layer clouds).",,"yes"
"435","62","CloudSchemeAttributes:CloudOverlap","Method for taking into account overlapping of cloud layers.",,"other"
"436","62","CloudSchemeAttributes:Processes","Cloud processes included in the cloud scheme (e.g. entrainment, detrainment, bulk cloud, etc.).",,"area cloud fraction, diagnostic RH_crit"
"437","62","CloudSchemeAttributes:CloudOverlapScheme",,,"Maximum-random overlap"
"438","62","SubGridScaleWaterDistribution:Type","Approach used for cloud water content and fractional cloud cover.",,"diagnostic"
"439","62","SubGridScaleWaterDistribution:FunctionName","Commonly used name of the probability density function (PDF) representing distribution of water vapor within a grid box.",,"symmetric triangular distribution"
"440","62","SubGridScaleWaterDistribution:FunctionOrder","Order of the function (PDF) used to represent subgrid scale water vapor distribution.",,"one moment"
"441","62","SubGridScaleWaterDistribution:CouplingWithConvection","Type(s) of convection the formation of clouds is coupled with.",,"coupled with deep and shallow"
"442","182","COSPAttributes:COSPRunConfiguration","Method used to run the CFMIP Observational Simulator Package.",,"inline"
"443","182","COSPAttributes:NumberOfGridpoints","Number of gridpoints used by COSP.",,"All"
"444","182","COSPAttributes:NumberOfColumns","Number of subcolumns used by COSP.",,"100"
"445","182","COSPAttributes:NumberOfLevels","Number of model levels used by COSP.",,"38"
"446","182","InputsRadar:RadarFrequency","CloudSat radar frequency.","GHz","94Ghz"
"447","182","InputsRadar:RadarType","Type of radar.",,"spaceborne"
"448","182","InputsRadar:UseGasAbsorption","Does the radar simulator include gaseous absorption?",,"yes"
"449","182","InputsRadar:UseEffectiveRadius","Is effective radius used by the radar simulator?",,"yes"
"450","182","InputsLidar:LidarIceType","Ice particle shape in lidar calculations.",,"Ice spheres"
"451","182","InputsLidar:Overlap","Overlap type.",,"max / random"
"452","182","ISSCPAttributes:TopHeight","Cloud top height management. IR brightness: Cloud top pressure adjusted using only the computed infrared IR brightness temperature. IR brightness and visible optical depth: Cloud top pressure adjusted using both a computed infrared IR brightness temperature and visible optical depth.",,"IR brightness and visible optical depth"
"453","182","ISSCPAttributes:TopHeightDirection","Direction for finding the radiance determined cloud-top pressure; atmosphere pressure level with interpolated temperature equal to the radiance determined cloud-top pressure.",,"highest altitude level"
"454","63","General Attributes:SpongeLayer","Sponge layer in the upper layers in order to avoid gravitywaves reflection at top.",,"N/A"
"455","63","General Attributes:Background","Background distribution of waves (???).",,"N/A"
"456","63","General Attributes:SubGridScaleOrography","Subgrid scale orography effects taken into account.",,"effect on drag"
"457","63","OrographicGravityWaves:SourceMechanisms","Physical mechanisms generating orographic gravity waves.",,"linear mountain waves, other"
"458","63","OrographicGravityWaves:CalculationMethod","Calculation method for orographic gravity waves.",,"other"
"459","63","OrographicGravityWaves:PropagationScheme","Type of propagation scheme for orographic gravity waves.",,"linear theory"
"460","63","OrographicGravityWaves:DissipationScheme","Type of dissipation scheme for orographic gravity waves.",,"single wave"
"461","63","OrographicGravityWaves:CalculationMethodDetail",,,"Accounts for the anisotropy of the sub-grid orography in calculating the surface stress."
"462","63","ConvectiveGravityWaves:PropagationScheme","Type of propagation scheme for convective gravity waves.",,"N/A"
"463","63","ConvectiveGravityWaves:DissipationScheme","Type of dissipation scheme for convective gravity waves.",,"N/A"
"464","63","Non-OrographicGravityWaves:SourceMechanisms","Physical mechanisms generating non-orographic gravity waves. background spectrum: Background distribution of waves that naturally occurs in the atmosphere (e.g. from convective fronts).",,"background spectrum"
"465","63","Non-OrographicGravityWaves:CalculationMethod","Calculation method for non-orographic gravity waves.",,"spatially dependent, temporally dependent"
"466","63","Non-OrographicGravityWaves:PropagationScheme","Type of propagation scheme for non-orographic gravity waves.",,"non-linear theory"
"467","63","Non-OrographicGravityWaves:DissipationScheme","Type of dissipation scheme for non-orographic gravity waves.",,"spectral"
"1068","222","General Attributes:ImpactOnOzone","Impact of TOA radiation on stratospheric ozone.",,"no"
"1069","222","SolarConstant:Type","Time adaptation of the solar constant.",,"transient"
"1071","222","SolarConstant:Characteristics","Description of the solar constant.",,"normalised to give a mean solar constant of 1365 Wm-2 over the 2 solar cycles 1860-1881."
"1072","222","OrbitalParameters:Type","Time adaptation of the orbital parameters.",,"fixed"
"1073","222","OrbitalParameters:ComputationMethod","Method used for computing orbital parameters.",,"Berger 1978"
"1074","222","OrbitalParameters:ReferenceDate","Reference year for orbital parameters.",,"2000"
